{
  "catalogKey": "runway/seedance2_fast",
  "modelId": "seedance2_fast",
  "profiles": [
    {
      "aspectRatios": [
        "16:9",
        "9:16",
        "1:1"
      ],
      "catalogKey": "runway/seedance2_fast/t2v_range_720p",
      "displayName": "Text to Video · 2–12s · 720p",
      "durationPolicy": "range",
      "durationStepSeconds": 1,
      "generationMode": "text_to_video",
      "isDefault": true,
      "maxDurationSeconds": 12,
      "minDurationSeconds": 2,
      "outputAudio": true,
      "pricingTierCodes": [
        "res_480p_720p"
      ],
      "profileCode": "t2v_range_720p",
      "resolution": "720p",
      "resolutionTierCode": "res_720p",
      "sortOrder": 10,
      "wireParameters": {
        "duration": "2-12",
        "resolution": "720p"
      }
    },
    {
      "aspectRatios": [
        "16:9",
        "9:16",
        "1:1"
      ],
      "catalogKey": "runway/seedance2_fast/i2v_range_720p",
      "displayName": "Image to Video · 2–12s · 720p",
      "durationPolicy": "range",
      "durationStepSeconds": 1,
      "generationMode": "image_to_video",
      "isDefault": false,
      "maxDurationSeconds": 12,
      "minDurationSeconds": 2,
      "outputAudio": true,
      "pricingTierCodes": [
        "res_480p_720p"
      ],
      "profileCode": "i2v_range_720p",
      "resolution": "720p",
      "resolutionTierCode": "res_720p",
      "sortOrder": 20,
      "wireParameters": {
        "duration": "2-12",
        "resolution": "720p"
      }
    },
    {
      "aspectRatios": [
        "16:9",
        "9:16",
        "1:1"
      ],
      "catalogKey": "runway/seedance2_fast/r2v_range_720p",
      "displayName": "Reference to Video · 2–12s · 720p",
      "durationPolicy": "range",
      "durationStepSeconds": 1,
      "generationMode": "reference_to_video",
      "isDefault": false,
      "maxDurationSeconds": 12,
      "minDurationSeconds": 2,
      "outputAudio": true,
      "pricingTierCodes": [
        "res_480p_720p"
      ],
      "profileCode": "r2v_range_720p",
      "resolution": "720p",
      "resolutionTierCode": "res_720p",
      "sortOrder": 30,
      "wireParameters": {
        "duration": "2-12",
        "resolution": "720p"
      }
    }
  ],
  "regionCode": "global",
  "schemaVersion": "1.0.0",
  "source": {
    "observedAt": "2026-10-26T00:00:00Z",
    "sourceUrl": "https://docs.dev.runwayml.com/guides/models/"
  },
  "vendorCode": "runway"
}
