{
  "catalogKey": "luma_ai/ray-3.2",
  "modelId": "ray-3.2",
  "profiles": [
    {
      "aspectRatios": [
        "16:9",
        "9:16",
        "1:1",
        "4:3",
        "3:4",
        "21:9"
      ],
      "catalogKey": "luma_ai/ray-3.2/t2v_discrete_720p",
      "displayName": "Text to Video · 5s / 10s · 720p",
      "durationOptions": [
        5,
        10
      ],
      "durationPolicy": "discrete",
      "durationTierCodes": [
        "dur_5s",
        "dur_10s"
      ],
      "generationMode": "text_to_video",
      "isDefault": true,
      "outputAudio": false,
      "profileCode": "t2v_discrete_720p",
      "resolution": "720p",
      "resolutionTierCode": "res_720p",
      "sortOrder": 10,
      "wireParameters": {
        "resolution": "720p"
      }
    },
    {
      "aspectRatios": [
        "16:9",
        "9:16",
        "1:1",
        "4:3",
        "3:4",
        "21:9"
      ],
      "catalogKey": "luma_ai/ray-3.2/i2v_discrete_720p",
      "displayName": "Image to Video · 5s / 10s · 720p",
      "durationOptions": [
        5,
        10
      ],
      "durationPolicy": "discrete",
      "durationTierCodes": [
        "dur_5s",
        "dur_10s"
      ],
      "generationMode": "image_to_video",
      "isDefault": false,
      "outputAudio": false,
      "profileCode": "i2v_discrete_720p",
      "resolution": "720p",
      "resolutionTierCode": "res_720p",
      "sortOrder": 20,
      "wireParameters": {
        "resolution": "720p"
      }
    }
  ],
  "regionCode": "global",
  "schemaVersion": "1.0.0",
  "source": {
    "observedAt": "2026-10-26T00:00:00Z",
    "sourceUrl": "https://docs.agents.lumalabs.ai/guides/videos/generation"
  },
  "vendorCode": "luma_ai"
}
