{
  "catalogKey": "vidu/viduq3",
  "modelId": "viduq3",
  "profiles": [
    {
      "aspectRatios": [
        "16:9",
        "9:16",
        "1:1"
      ],
      "catalogKey": "vidu/viduq3/t2v_range_720p",
      "displayName": "Text to Video · 5–10s · 720p",
      "durationPolicy": "range",
      "durationStepSeconds": 1,
      "generationMode": "text_to_video",
      "isDefault": true,
      "maxDurationSeconds": 10,
      "minDurationSeconds": 5,
      "outputAudio": true,
      "pricingTierCodes": [
        "ref_res_720p"
      ],
      "profileCode": "t2v_range_720p",
      "resolution": "720p",
      "resolutionTierCode": "res_720p",
      "sortOrder": 10,
      "wireParameters": {
        "duration": "5-10",
        "resolution": "720p"
      }
    },
    {
      "aspectRatios": [
        "16:9",
        "9:16",
        "1:1"
      ],
      "catalogKey": "vidu/viduq3/i2v_range_720p",
      "displayName": "Image to Video · 5–10s · 720p",
      "durationPolicy": "range",
      "durationStepSeconds": 1,
      "generationMode": "image_to_video",
      "isDefault": false,
      "maxDurationSeconds": 10,
      "minDurationSeconds": 5,
      "outputAudio": true,
      "pricingTierCodes": [
        "ref_res_720p"
      ],
      "profileCode": "i2v_range_720p",
      "resolution": "720p",
      "resolutionTierCode": "res_720p",
      "sortOrder": 20,
      "wireParameters": {
        "duration": "5-10",
        "resolution": "720p"
      }
    },
    {
      "aspectRatios": [
        "16:9",
        "9:16",
        "1:1"
      ],
      "catalogKey": "vidu/viduq3/r2v_range_720p",
      "displayName": "Reference to Video · 5–10s · 720p",
      "durationPolicy": "range",
      "durationStepSeconds": 1,
      "generationMode": "reference_to_video",
      "isDefault": false,
      "maxDurationSeconds": 10,
      "minDurationSeconds": 5,
      "outputAudio": true,
      "pricingTierCodes": [
        "ref_res_720p"
      ],
      "profileCode": "r2v_range_720p",
      "resolution": "720p",
      "resolutionTierCode": "res_720p",
      "sortOrder": 30,
      "wireParameters": {
        "duration": "5-10",
        "resolution": "720p"
      }
    }
  ],
  "regionCode": "cn",
  "schemaVersion": "1.0.0",
  "source": {
    "observedAt": "2026-10-26T00:00:00Z",
    "sourceUrl": "https://platform.vidu.cn/docs/pricing"
  },
  "vendorCode": "vidu"
}
