{
  "catalogKey": "minimax/MiniMax-H3-Regeneration",
  "modelId": "MiniMax-H3-Regeneration",
  "profiles": [
    {
      "aspectRatios": [
        "16:9",
        "9:16",
        "1:1"
      ],
      "catalogKey": "minimax/MiniMax-H3-Regeneration/r2v_range_768p",
      "displayName": "Reference to Video · 6–10s · 768p",
      "durationPolicy": "range",
      "durationStepSeconds": 1,
      "generationMode": "reference_to_video",
      "isDefault": true,
      "maxDurationSeconds": 10,
      "minDurationSeconds": 6,
      "outputAudio": false,
      "pricingTierCodes": [
        "regen_768p_to_2k"
      ],
      "profileCode": "r2v_range_768p",
      "resolution": "768p",
      "resolutionTierCode": "res_768p",
      "sortOrder": 10,
      "wireParameters": {
        "duration": "6-10",
        "resolution": "768p"
      }
    }
  ],
  "regionCode": "global",
  "schemaVersion": "1.0.0",
  "source": {
    "observedAt": "2026-10-26T00:00:00Z",
    "sourceUrl": "https://platform.minimax.io/docs/guides/pricing-paygo"
  },
  "vendorCode": "minimax"
}
