{
  "catalogKey": "google/veo-3.1-fast-generate-preview",
  "modelId": "veo-3.1-fast-generate-preview",
  "profiles": [
    {
      "aspectRatios": [
        "16:9",
        "9:16",
        "1:1"
      ],
      "catalogKey": "google/veo-3.1-fast-generate-preview/t2v_range_720p",
      "displayName": "Text to Video · 5–8s · 720p",
      "durationPolicy": "range",
      "durationStepSeconds": 1,
      "generationMode": "text_to_video",
      "isDefault": true,
      "maxDurationSeconds": 8,
      "minDurationSeconds": 5,
      "outputAudio": false,
      "profileCode": "t2v_range_720p",
      "resolution": "720p",
      "resolutionTierCode": "res_720p",
      "sortOrder": 10,
      "wireParameters": {
        "duration": "5-8",
        "resolution": "720p"
      }
    },
    {
      "aspectRatios": [
        "16:9",
        "9:16",
        "1:1"
      ],
      "catalogKey": "google/veo-3.1-fast-generate-preview/i2v_range_720p",
      "displayName": "Image to Video · 5–8s · 720p",
      "durationPolicy": "range",
      "durationStepSeconds": 1,
      "generationMode": "image_to_video",
      "isDefault": false,
      "maxDurationSeconds": 8,
      "minDurationSeconds": 5,
      "outputAudio": false,
      "profileCode": "i2v_range_720p",
      "resolution": "720p",
      "resolutionTierCode": "res_720p",
      "sortOrder": 20,
      "wireParameters": {
        "duration": "5-8",
        "resolution": "720p"
      }
    }
  ],
  "regionCode": "global",
  "schemaVersion": "1.0.0",
  "source": {
    "observedAt": "2026-10-26T00:00:00Z",
    "sourceUrl": "https://ai.google.dev/gemini-api/docs/pricing"
  },
  "vendorCode": "google"
}
