{
  "catalogKey": "openai/sora-2",
  "modelId": "sora-2",
  "profiles": [
    {
      "aspectRatios": [
        "16:9",
        "9:16"
      ],
      "catalogKey": "openai/sora-2/t2v_continuous_720p",
      "displayName": "Text to Video · 4–12s · 720p",
      "durationPolicy": "continuous",
      "durationStepSeconds": 1,
      "generationMode": "text_to_video",
      "isDefault": true,
      "maxDurationSeconds": 12,
      "minDurationSeconds": 4,
      "outputAudio": false,
      "profileCode": "t2v_continuous_720p",
      "resolution": "720p",
      "resolutionTierCode": "res_720p",
      "sortOrder": 10,
      "wireParameters": {
        "seconds": "4-12",
        "size": "1280x720"
      }
    },
    {
      "aspectRatios": [
        "16:9",
        "9:16"
      ],
      "catalogKey": "openai/sora-2/i2v_continuous_720p",
      "displayName": "Image to Video · 4–12s · 720p",
      "durationPolicy": "continuous",
      "durationStepSeconds": 1,
      "generationMode": "image_to_video",
      "maxDurationSeconds": 12,
      "minDurationSeconds": 4,
      "outputAudio": false,
      "profileCode": "i2v_continuous_720p",
      "resolution": "720p",
      "resolutionTierCode": "res_720p",
      "sortOrder": 20,
      "wireParameters": {
        "seconds": "4-12",
        "size": "1280x720"
      }
    }
  ],
  "regionCode": "global",
  "schemaVersion": "1.0.0",
  "source": {
    "observedAt": "2026-10-26T00:00:00Z",
    "sourceUrl": "https://platform.openai.com/docs/models/sora-2"
  },
  "vendorCode": "openai"
}
